<?xml version="1.0" encoding="UTF-8"?>
<userData xmlns:xsi="http://www.w3.org/2001/XMLSchema-instance" xsi:noNamespaceSchemaLocation="file:///D:/about/ab.xsd">
	<user ID="0000000005">
		<Username>bob</Username>
		<Password>abcdef</Password>
		<Firstname>bobby</Firstname>
		<Lastname>sheahan</Lastname>
		<To-doList TDL_ID = "0000000005">
			<To-do Todo_ID="0000000001">
				<Text_data>yeps</Text_data>
				<Date_created>2019-02-26</Date_created>
				<Due_date>2019-04-21</Due_date>
				<Is_completed>0</Is_completed>
				<Is_shown>1</Is_shown>
			</To-do>
		</To-doList>
		<MemoList ML_ID = "0000000005">
			<Memo Memo_ID="0000000001">
				<Journal_cdata>data thats is needed</Journal_cdata>
				<Date_created>2019-03-25</Date_created>
				<Collection_id>0000000003</Collection_id>
				<Is_in_collection>2</Is_in_collection>
				<Is_shown>1</Is_shown>
			</Memo>
		</MemoList>
	</user>
</userData>
